{
  "allowed_operations": ["github.open_pr"],
  "classification": "secret_reference",
  "id": "credref_018f3e40-7b80-7a21-8000-000000000006",
  "kind": "CredentialRef",
  "owner_actor_id": "human_maintainer",
  "provider_key": "github-app-primary",
  "purpose": "Open proposal pull requests",
  "resolver_policy": "spec024.github-app",
  "schema_version": "1.0.0"
}
